{
  "$schema": "https://json-schema.org/draft/2020-12/schema",
  "$id": "https://crowdcast.local/schemas/judgment.schema.json",
  "title": "판정",
  "description": "판정 엔진 결과. ruleIds = 판정에 쓴 규칙(그래프 cc:judgedBy), 사유 문구는 규칙 결과 템플릿",
  "type": "object",
  "additionalProperties": false,
  "required": [
    "level",
    "label",
    "ruleIds",
    "reasons",
    "checklist"
  ],
  "properties": {
    "level": {
      "$ref": "common.schema.json#/$defs/level"
    },
    "label": {
      "enum": [
        "소규모",
        "수립 권고",
        "수립 대상",
        "대규모"
      ]
    },
    "ruleIds": {
      "type": "array",
      "items": {
        "$ref": "common.schema.json#/$defs/ruleId"
      },
      "minItems": 1,
      "uniqueItems": true
    },
    "reasons": {
      "type": "array",
      "items": {
        "type": "object",
        "additionalProperties": false,
        "required": [
          "ruleId",
          "kind",
          "text",
          "clauseId",
          "evidenceId"
        ],
        "properties": {
          "ruleId": {
            "$ref": "common.schema.json#/$defs/ruleId"
          },
          "kind": {
            "enum": [
              "법정",
              "자체"
            ]
          },
          "text": {
            "type": "string"
          },
          "clauseId": {
            "anyOf": [
              {
                "$ref": "common.schema.json#/$defs/clauseId"
              },
              {
                "type": "null"
              }
            ]
          },
          "evidenceId": {
            "$ref": "common.schema.json#/$defs/evidenceId"
          }
        },
        "allOf": [
          {
            "if": {
              "type": "object",
              "properties": {
                "kind": {
                  "const": "법정"
                }
              }
            },
            "then": {
              "type": "object",
              "properties": {
                "clauseId": {
                  "$ref": "common.schema.json#/$defs/clauseId"
                }
              }
            }
          }
        ]
      },
      "minItems": 1
    },
    "checklist": {
      "type": "array",
      "items": {
        "type": "object",
        "additionalProperties": false,
        "required": [
          "id",
          "text",
          "ruleId",
          "evidenceIds"
        ],
        "properties": {
          "id": {
            "$ref": "common.schema.json#/$defs/checklistId"
          },
          "text": {
            "type": "string"
          },
          "ruleId": {
            "$ref": "common.schema.json#/$defs/ruleId"
          },
          "evidenceIds": {
            "type": "array",
            "items": {
              "$ref": "common.schema.json#/$defs/evidenceId"
            },
            "minItems": 1
          }
        }
      }
    }
  }
}
